{
  "$schema": "https://aidd.framework/schemas/handoff-v1.json",
  "producer_skill": "aidd-video-materializer",
  "producer_version": "1.0.0",
  "status": "SUCCESS",
  "artifacts": {
    "final_video_mp4": "C:\\Users\\trcnologia\\orca\\workspaces\\proj_stepo\\feature-matt-penny\\aidd-pipelines\\canal-dark-avatar\\context\\output\\video_final_keera_br.mp4",
    "audio_track": "C:\\Users\\trcnologia\\orca\\workspaces\\proj_stepo\\feature-matt-penny\\aidd-pipelines\\canal-dark-avatar\\context\\output\\audio_neural_intro.mp3",
    "remotion_clip": "C:\\Users\\trcnologia\\orca\\workspaces\\proj_stepo\\feature-matt-penny\\aidd-pipelines\\canal-dark-avatar\\context\\output\\remotion_scene.mp4",
    "avatar_visual": "C:\\Users\\trcnologia\\orca\\workspaces\\proj_stepo\\feature-matt-penny\\aidd-pipelines\\canal-dark-avatar\\context\\output\\avatar_placeholder.jpg"
  },
  "domain_data": {
    "channel": "Dark Tech Brasil",
    "resolution": "1920x1080",
    "fps": 60,
    "status": "READY_FOR_PUBLISH"
  }
}