{
  "$schema": "https://aidd.framework/schemas/handoff-v1.json",
  "producer_skill": "aidd-dark-storycraft",
  "producer_version": "1.0.0",
  "status": "SUCCESS",
  "artifacts": {
    "roteiro_mestre": "C:\\Users\\trcnologia\\orca\\workspaces\\proj_stepo\\feature-matt-penny\\aidd-pipelines\\canal-dark-avatar\\context\\handoffs\\01_roteiro_ptbr.json",
    "total_cenas": 4,
    "hook_15s": "Fala galera! Eu tenho testado o Google Flow a fundo nos últimos dias, e hoje eu quero te mostrar uma das novidades mais poderosas que a Google acabou de liberar: o Storyboard Studio. Dá pra criar um roteiro e gerar toda a animação visual em minutos. Se liga só nisso."
  },
  "domain_data": {
    "version": "1.0.0",
    "canal_target": "Dark Tech Brasil",
    "avatar": {
      "persona": "Apresentadora Tech Hiper-realista",
      "idioma": "pt-BR",
      "tom_de_voz": "Calmo, confiante, ritmo rápido, sem enrolação"
    },
    "titulo_ptbr": "Como Usar o Storyboard Studio no Google Flow (Passo a Passo)",
    "hook_retencao_15s": "Fala galera! Eu tenho testado o Google Flow a fundo nos últimos dias, e hoje eu quero te mostrar uma das novidades mais poderosas que a Google acabou de liberar: o Storyboard Studio. Dá pra criar um roteiro e gerar toda a animação visual em minutos. Se liga só nisso.",
    "scenes": [
      {
        "scene_id": "cena-01-hook",
        "tipo": "AVATAR_TELA_CHEIA",
        "duracao_estimada_s": 14.5,
        "fala_avatar": "Fala galera! Eu tenho testado o Google Flow a fundo nos últimos dias, e hoje eu quero te mostrar uma das novidades mais poderosas da Google: o Storyboard Studio. Dá pra pegar uma ideia crua e transformar em storyboard animado quase sem esforço.",
        "visual": "Avatar em estúdio moderno, iluminação suave, enquadramento médio.",
        "b_roll": "nenhum"
      },
      {
        "scene_id": "cena-02-conceito-remotion",
        "tipo": "ANIMACAO_REMOTION",
        "duracao_estimada_s": 18.0,
        "fala_avatar": "O fluxo se divide em 4 etapas principais: primeiro o roteiro automatizado, segundo a geração de assets, terceiro o storyboard visual e quarto a animação com o modelo Omni Flash.",
        "visual": "Diagrama de blocos conectado por curvas Bézier e cards com física de mola (Remotion 60fps).",
        "b_roll": "motores/remotion"
      },
      {
        "scene_id": "cena-03-demonstracao-tela",
        "tipo": "TELA_SOFTWARE_COM_AVATAR_PIP",
        "duracao_estimada_s": 45.0,
        "fala_avatar": "Dentro do Google Flow, você seleciona o estilo visual do seu projeto: 3D Animation, Concept Sketch ou Realista. Ao ativar o Agent Mode, a IA divide a cena em ações, personagens e diálogos automaticamente.",
        "visual": "Gravação de tela do Google Flow com avatar pequeno no canto inferior direito.",
        "b_roll": "screencast/google_flow"
      },
      {
        "scene_id": "cena-04-fechamento-cta",
        "tipo": "AVATAR_TELA_CHEIA",
        "duracao_estimada_s": 16.0,
        "fala_avatar": "Esse foi o primeiro passo no novo Storyboard Studio. O que você achou desse fluxo de trabalho? Deixa aqui nos comentários se você quer ver mais testes com os modelos da Google. Não esquece do like e de se inscrever para não perder os próximos tutoriais. Valeu e até a próxima!",
        "visual": "Avatar agradecendo, card de inscrição animado e links na tela.",
        "b_roll": "nenhum"
      }
    ]
  }
}