{
  "$schema": "https://aidd.framework/schemas/handoff-v1.json",
  "producer_skill": "aidd-video-reengineer",
  "producer_version": "1.6.0",
  "timestamp": "20260618",
  "status": "SUCCESS",
  "artifacts": {
    "canonical_dir": "research\\videos\\qCPlEOY2zgI--genai-with-how-to-use",
    "metodologia": "research\\videos\\qCPlEOY2zgI--genai-with-how-to-use\\metodologia.md",
    "gap_analysis": "research\\videos\\qCPlEOY2zgI--genai-with-how-to-use\\gap_analysis.md",
    "prompts_detectados": "research\\videos\\qCPlEOY2zgI--genai-with-how-to-use\\visual\\prompts_detectados.txt",
    "thumbnail": "research\\videos\\qCPlEOY2zgI--genai-with-how-to-use\\visual\\thumbnail.jpg",
    "manifest": "research\\videos\\qCPlEOY2zgI--genai-with-how-to-use\\manifest.json",
    "conteudo_tecnico": "research\\videos\\qCPlEOY2zgI--genai-with-how-to-use\\conteudo_tecnico.md",
    "estrutura_narrativa": "research\\videos\\qCPlEOY2zgI--genai-with-how-to-use\\estrutura_narrativa.md"
  },
  "domain_data": {
    "video_id": "qCPlEOY2zgI",
    "title": "How to Use Storyboard Studio in Google Flow (Step-by-Step)",
    "author": "GenAI with Keera",
    "duration_seconds": 344
  }
}